{"coverage_end":"2026-08-28","scope_id":"physical-ai-v1","shards":[{"compressed_sha256":"sha256:e91d6c81bdb678010c22955a21c88dc61a49d7d3048e9cd20a891fe02362f8bd","compressed_size":7191,"path":"scopes/physical-ai-v1/state/membership/objects/sha256/e9/e91d6c81bdb678010c22955a21c88dc61a49d7d3048e9cd20a891fe02362f8bd.jsonl.gz","prefix":"00","record_count":182,"uncompressed_sha256":"sha256:409f069faf1e30482d33022600fd70a1889c8adc34a7bfbe14e4b3e14cbc4bb2","uncompressed_size":29848},{"compressed_sha256":"sha256:dda5e10b9b6f4cfb29efeaff10a03f012c945a9e55145b651f8fb9e32a1329f2","compressed_size":7479,"path":"scopes/physical-ai-v1/state/membership/objects/sha256/dd/dda5e10b9b6f4cfb29efeaff10a03f012c945a9e55145b651f8fb9e32a1329f2.jsonl.gz","prefix":"01","record_count":189,"uncompressed_sha256":"sha256:c1ac3d66dd4bc2008cf279e0c7f7848e2d6d7788db3ca13492eae3f78cdb1631","uncompressed_size":30996},{"compressed_sha256":"sha256:0bbb5cc1a7fc5d1770fda90f69c06c0a5534f76191e07e76925baca239e89aad","compressed_size":6640,"path":"scopes/physical-ai-v1/state/membership/objects/sha256/0b/0bbb5cc1a7fc5d1770fda90f69c06c0a5534f76191e07e76925baca239e89aad.jsonl.gz","prefix":"02","record_count":168,"uncompressed_sha256":"sha256:19966636e7b167d5f27d6f40efbdac94efe0fb0a048854dcdecf502f67d4b884","uncompressed_size":27552},{"compressed_sha256":"sha256:e69182b7b40aadf26fa491caf28ee8130525f58bd557102f754373bc083bf936","compressed_size":6645,"path":"scopes/physical-ai-v1/state/membership/objects/sha256/e6/e69182b7b40aadf26fa491caf28ee8130525f58bd557102f754373bc083bf936.jsonl.gz","prefix":"03","record_count":168,"uncompressed_sha256":"sha256:a844fef7a745a04026bd1b75c65b06693e24854b2c5c14943d986ec410110c32","uncompressed_size":27552},{"compressed_sha256":"sha256:0f26c2bbd8bcf231262e314ef26c3e5d88714d41cd5a6b563b6b3340832d82e6","compressed_size":6366,"path":"scopes/physical-ai-v1/state/membership/objects/sha256/0f/0f26c2bbd8bcf231262e314ef26c3e5d88714d41cd5a6b563b6b3340832d82e6.jsonl.gz","prefix":"04","record_count":161,"uncompressed_sha256":"sha256:24bb5bc19ed1a7886c54fbfba195b259eeeb4d732897977469de46e6ee5a85e3","uncompressed_size":26404},{"compressed_sha256":"sha256:cf2b28111ecc20aaf3dcb4ba2d0778498698224c13bf717b1f6cda6d117da600","compressed_size":7233,"path":"scopes/physical-ai-v1/state/membership/objects/sha256/cf/cf2b28111ecc20aaf3dcb4ba2d0778498698224c13bf717b1f6cda6d117da600.jsonl.gz","prefix":"05","record_count":183,"uncompressed_sha256":"sha256:9bbfdbab366e6b2304904e56fa54f30592f49d40d66a411e92e1648c138eaa37","uncompressed_size":30012},{"compressed_sha256":"sha256:78d4ca2c01093fe2cc1cf4acc0a5a022c8ba3eb0a8f3c3f3ada2d2a2d0f11ea4","compressed_size":7226,"path":"scopes/physical-ai-v1/state/membership/objects/sha256/78/78d4ca2c01093fe2cc1cf4acc0a5a022c8ba3eb0a8f3c3f3ada2d2a2d0f11ea4.jsonl.gz","prefix":"06","record_count":183,"uncompressed_sha256":"sha256:380faa4527edc4834d388465f5251e2e78160513961f89edfd89949a81679441","uncompressed_size":30012},{"compressed_sha256":"sha256:55dd48d65aa68a2cbbdd9db8821a45671893390d929666fe0df9ad8a84815ed2","compressed_size":7203,"path":"scopes/physical-ai-v1/state/membership/objects/sha256/55/55dd48d65aa68a2cbbdd9db8821a45671893390d929666fe0df9ad8a84815ed2.jsonl.gz","prefix":"07","record_count":182,"uncompressed_sha256":"sha256:bbf93294a2b5db0e5f859e94e2169a9cd9633c3a3107fdd915cefbfae9df4895","uncompressed_size":29848},{"compressed_sha256":"sha256:e971df3750b9f40bcb1b85d9da0a414cf00759ddc62dbeb7529b8dd0f576a8eb","compressed_size":7208,"path":"scopes/physical-ai-v1/state/membership/objects/sha256/e9/e971df3750b9f40bcb1b85d9da0a414cf00759ddc62dbeb7529b8dd0f576a8eb.jsonl.gz","prefix":"08","record_count":182,"uncompressed_sha256":"sha256:e2d38851b7453be6f0a84a00fbf3edf0365b7528eed13c2b630e62ff935dbaf4","uncompressed_size":29848},{"compressed_sha256":"sha256:76ad93b392038452033095195e0b283547ca5c5600f5041fcf5c16a1070109a7","compressed_size":7293,"path":"scopes/physical-ai-v1/state/membership/objects/sha256/76/76ad93b392038452033095195e0b283547ca5c5600f5041fcf5c16a1070109a7.jsonl.gz","prefix":"09","record_count":184,"uncompressed_sha256":"sha256:346fd226fb2d8b58e26cd4a210d2b88fe339627d9ea5ed289df29d13d36e4c80","uncompressed_size":30176},{"compressed_sha256":"sha256:2b9c995f208517e617453be6b9ecdedb7095f6e46964ae24d624fa703b065e0b","compressed_size":6618,"path":"scopes/physical-ai-v1/state/membership/objects/sha256/2b/2b9c995f208517e617453be6b9ecdedb7095f6e46964ae24d624fa703b065e0b.jsonl.gz","prefix":"0a","record_count":167,"uncompressed_sha256":"sha256:238872e5107933728057ca8e0eec2e80fdfcf4c77e749ecab979a4ddd65d95fe","uncompressed_size":27388},{"compressed_sha256":"sha256:4fc1d8f5e42654101066db060383b75f6388dc45454ca21a9e4fdc8499d4569e","compressed_size":7048,"path":"scopes/physical-ai-v1/state/membership/objects/sha256/4f/4fc1d8f5e42654101066db060383b75f6388dc45454ca21a9e4fdc8499d4569e.jsonl.gz","prefix":"0b","record_count":178,"uncompressed_sha256":"sha256:d129b8958ef872a6becbf96360bbd653e87f58d4ff48beb58dc34bc068a124d0","uncompressed_size":29192},{"compressed_sha256":"sha256:e5b20860fb5966dfa4c841973857e2ca12fb8fb99d9485b634ac04881e6ac389","compressed_size":7036,"path":"scopes/physical-ai-v1/state/membership/objects/sha256/e5/e5b20860fb5966dfa4c841973857e2ca12fb8fb99d9485b634ac04881e6ac389.jsonl.gz","prefix":"0c","record_count":178,"uncompressed_sha256":"sha256:18ec613a7c285742e5a6877dab198bf65e6f4250f7a76da991a2d17800d2b0a9","uncompressed_size":29192},{"compressed_sha256":"sha256:6c7e409162720424dfd1fd547deb5503727fce5d7d744fa74785165111098b6e","compressed_size":8055,"path":"scopes/physical-ai-v1/state/membership/objects/sha256/6c/6c7e409162720424dfd1fd547deb5503727fce5d7d744fa74785165111098b6e.jsonl.gz","prefix":"0d","record_count":204,"uncompressed_sha256":"sha256:b775cf961298adb501dd8f1b4fe4d522f44d00ece85a41bdb18e52f0a78c84ca","uncompressed_size":33456},{"compressed_sha256":"sha256:83d359e171a87171c7516de8e5edefa21d971fdce1cd7fadacd3bae5ba6d95c8","compressed_size":6766,"path":"scopes/physical-ai-v1/state/membership/objects/sha256/83/83d359e171a87171c7516de8e5edefa21d971fdce1cd7fadacd3bae5ba6d95c8.jsonl.gz","prefix":"0e","record_count":171,"uncompressed_sha256":"sha256:48c634865092c4d13d3f763b2137363f8cc1aa8d65c6b3940b512c8807031bd8","uncompressed_size":28044},{"compressed_sha256":"sha256:50a63c915ef62bbdecd1b039f9e2e7daa91049b0919369db5abf2d808309c4a8","compressed_size":6841,"path":"scopes/physical-ai-v1/state/membership/objects/sha256/50/50a63c915ef62bbdecd1b039f9e2e7daa91049b0919369db5abf2d808309c4a8.jsonl.gz","prefix":"0f","record_count":173,"uncompressed_sha256":"sha256:4fead08f802f41a4c4e208c206ec292020b9ac9b0fe2acda76b636a416f03104","uncompressed_size":28372},{"compressed_sha256":"sha256:0ea768addf025eec78a4d4d74d720b1037af73601679532cd01f21f229140aac","compressed_size":6342,"path":"scopes/physical-ai-v1/state/membership/objects/sha256/0e/0ea768addf025eec78a4d4d74d720b1037af73601679532cd01f21f229140aac.jsonl.gz","prefix":"10","record_count":161,"uncompressed_sha256":"sha256:064c754e352861b09df067f79fd20b1af2cca5e7566267305fda26a2531ab1ed","uncompressed_size":26404},{"compressed_sha256":"sha256:1d1911f1f90f8422c0e167b6f0a2930c7d8479e05af5f945fd521e0fa2f2f2f9","compressed_size":7431,"path":"scopes/physical-ai-v1/state/membership/objects/sha256/1d/1d1911f1f90f8422c0e167b6f0a2930c7d8479e05af5f945fd521e0fa2f2f2f9.jsonl.gz","prefix":"11","record_count":188,"uncompressed_sha256":"sha256:e9445be060f4901e99145ff03d7d8b4ff3b30d0ad984779ce4397d2935d72b8d","uncompressed_size":30832},{"compressed_sha256":"sha256:2a33c7d6b40d7b8496d5735173faebdc33a6b7aa538ae88382c364d1734e62b5","compressed_size":6721,"path":"scopes/physical-ai-v1/state/membership/objects/sha256/2a/2a33c7d6b40d7b8496d5735173faebdc33a6b7aa538ae88382c364d1734e62b5.jsonl.gz","prefix":"12","record_count":170,"uncompressed_sha256":"sha256:03bb1db42b55f355d41c170899f10036b40c3b2433eb89ed59d47e37cbf9f4d4","uncompressed_size":27880},{"compressed_sha256":"sha256:f08fea721b2ddc7c4da52d3b4fc9726f636fac56bb1f100ed7a05c5af861dcbe","compressed_size":7238,"path":"scopes/physical-ai-v1/state/membership/objects/sha256/f0/f08fea721b2ddc7c4da52d3b4fc9726f636fac56bb1f100ed7a05c5af861dcbe.jsonl.gz","prefix":"13","record_count":183,"uncompressed_sha256":"sha256:f86acb856d65c8a50d6f62e82c35043e31cc56a0a960552987b9ac97da55367a","uncompressed_size":30012},{"compressed_sha256":"sha256:2eb2d1fd10378c904b9d9d300f9451556503518fd64a616894b9acdbad9e6a13","compressed_size":6381,"path":"scopes/physical-ai-v1/state/membership/objects/sha256/2e/2eb2d1fd10378c904b9d9d300f9451556503518fd64a616894b9acdbad9e6a13.jsonl.gz","prefix":"14","record_count":161,"uncompressed_sha256":"sha256:5e7ffc6032bf373816c0e77aa555f3b14358cae41de8b2c636ac4c006235cc35","uncompressed_size":26404},{"compressed_sha256":"sha256:51e014d233173c3a3b7d27e543cfa02b4e9774191ce197dab4623f50cdcebaec","compressed_size":6373,"path":"scopes/physical-ai-v1/state/membership/objects/sha256/51/51e014d233173c3a3b7d27e543cfa02b4e9774191ce197dab4623f50cdcebaec.jsonl.gz","prefix":"15","record_count":161,"uncompressed_sha256":"sha256:cd4791703c3b20a5b30f752b6c031197da2e3099656850cdc32adf50ead70e5f","uncompressed_size":26404},{"compressed_sha256":"sha256:dd15cd142ba99b54c32a28ea2b6687fb6b73197da9962ef4086e2bfdd66cf905","compressed_size":5896,"path":"scopes/physical-ai-v1/state/membership/objects/sha256/dd/dd15cd142ba99b54c32a28ea2b6687fb6b73197da9962ef4086e2bfdd66cf905.jsonl.gz","prefix":"16","record_count":149,"uncompressed_sha256":"sha256:f1e69f5b35412aa32b510dcc0f6a45415f2f6e906ac6a2f2fbf7e4f06290f7e7","uncompressed_size":24436},{"compressed_sha256":"sha256:6889d05c42e802966320c318c3ee3ca46cbf393030e18885edc7aee8e6f81aff","compressed_size":6995,"path":"scopes/physical-ai-v1/state/membership/objects/sha256/68/6889d05c42e802966320c318c3ee3ca46cbf393030e18885edc7aee8e6f81aff.jsonl.gz","prefix":"17","record_count":177,"uncompressed_sha256":"sha256:0dbfc2eb503b6ec934b0cc785dcce3771669e9b775c3ff0aafa21669ba4cd6bc","uncompressed_size":2902